{
  "process": "Process_WireframeDesignReview, GW_Iterate = no (End_WDR: wireframe accepted)",
  "accepted": "a.html",
  "states": [
    "a.html",
    "a-home.html"
  ],
  "acceptedBy": {
    "kind": "human",
    "id": "owner"
  },
  "acceptedOn": "2026-10-09",
  "covers": [
    "reviews/human-1.json",
    "reviews/agent-1.json",
    "decision.json",
    "post-review-patch.json"
  ],
  "history": [
    "round 1: A (Manage blue) vs B (neutral charcoal); A chosen with the logo inverted (decision.json)"
  ]
}
